{
  "schemaVersion": 1,
  "projectId": "ium-lernwerk",
  "asOf": "2026-09-03",
  "scope": {
    "grades": [5, 6, 7],
    "schoolType": "Gymnasium Baden-Württemberg",
    "level": "E",
    "maturity": "working",
    "contentProduction": "frozen"
  },
  "principleGroups": [
    {
      "id": "goal-and-purpose",
      "label": "Ziel und Sinn",
      "principles": [
        {
          "id": "LXF04-PR-001",
          "title": "Ziel, Lernhandlung und Nachweis kohärent planen",
          "decision": "Jeder Lernbogen verbindet einen fachlichen Zielzustand mit einer dazu passenden Lernhandlung und einem interpretierbaren Produkt; Medien- oder Methodenlabels ersetzen diese Verbindung nicht.",
          "claimIds": ["CLAIM-LP-001", "CLAIM-V2-LXF-ICAP-001"],
          "decisionBasis": "V2-REQ-LXF-001; LXF03-S-007; LXF03-E-006",
          "obligation": "required",
          "appliesTo": ["learning-sequence", "task", "assessment", "teacher-orchestration"],
          "positivePatterns": [
            "Ziel, Auftrag, fachliche Denkhandlung und Lernprodukt benennen dieselbe fachliche Beziehung.",
            "Die Lehrkraft kann am Produkt entscheiden, ob erklärt, unterstützt, geübt oder weitergeführt wird."
          ],
          "antiPatterns": [
            "Lesen, Klicken, Sammeln oder Gruppenarbeit werden ohne fachliche Denkhandlung als Lernen ausgegeben.",
            "Ein abgeschlossenes Interface oder ein abgegebener Datensatz gilt allein als Lernnachweis."
          ],
          "observableCriteria": [
            "Eine fachkundige Person kann Ziel, Handlung und Produkt ohne Ergänzung miteinander abgleichen.",
            "Das Produkt zeigt eine Erklärung, Begründung, Anwendung, Analyse oder Revision statt bloßer Aktivität."
          ],
          "verificationMethods": ["expert-review", "content-walkthrough", "classroom-pilot"],
          "status": "reviewed"
        },
        {
          "id": "LXF04-PR-002",
          "title": "Sinn und begrenzte Wahl fachlich begründen",
          "decision": "Zweckklärung und Wahlmöglichkeiten werden nur eingesetzt, wenn sie die gleiche fachliche Kernhandlung tragen und keine persönliche Offenlegung verlangen.",
          "claimIds": ["CLAIM-LP-011", "CLAIM-V2-LXF-SDT-001"],
          "decisionBasis": "V2-REQ-LXF-001; LXF03-S-011; LXF03-E-016",
          "obligation": "conditional",
          "appliesTo": ["learner-material", "task", "learning-sequence"],
          "positivePatterns": [
            "Mehrere Kontexte oder Ausdruckswege führen zu derselben Kernleistung und denselben Kriterien.",
            "Der Zweck erklärt, wofür das Lernprodukt im weiteren Lernprozess gebraucht wird."
          ],
          "antiPatterns": [
            "Dekorative Auswahl, Punkte oder Themenkosmetik werden als Autonomie oder Motivation ausgegeben.",
            "Persönliche Medienerfahrungen müssen öffentlich offengelegt werden, um teilnehmen zu können."
          ],
          "observableCriteria": [
            "Jede Wahloption wahrt Lernziel, Kernhandlung und Qualitätsmaßstab.",
            "Lernende können Zweck und nächste Verwendung ihres Produkts erklären."
          ],
          "verificationMethods": ["content-walkthrough", "usability-test", "classroom-pilot"],
          "status": "reviewed"
        }
      ]
    },
    {
      "id": "prior-knowledge-and-cognitive-load",
      "label": "Vorwissen und kognitive Belastung",
      "principles": [
        {
          "id": "LXF04-PR-003",
          "title": "Vorwissen aufgabenbezogen sichtbar machen",
          "decision": "Planungsrelevantes Vorwissen wird durch ein kleines fachliches Produkt sichtbar gemacht und erst nach Klärung von Sprache, Darstellung und Aufgabenform für die weitere Unterstützung genutzt.",
          "claimIds": ["CLAIM-LP-002", "CLAIM-LP-012"],
          "decisionBasis": "V2-REQ-LXF-001; LXF03-S-001; LXF03-E-001",
          "obligation": "required",
          "appliesTo": ["learning-sequence", "task", "assessment", "teacher-orchestration"],
          "positivePatterns": [
            "Vorhersage, Sortierung, Modellskizze oder Kontrastfall erzeugen ein kurzes fachliches Produkt.",
            "Ein Haltepunkt trennt fehlenden Begriff, unzutreffende Vorstellung und unvertraute Aufgabenform."
          ],
          "antiPatterns": [
            "Jahrgang, Mediennutzung oder eine Einzelantwort werden als stabiles Vorwissensprofil behandelt.",
            "Eine offene Einstiegsfrage bleibt ohne Auswertung und Anschlussentscheidung."
          ],
          "observableCriteria": [
            "Das Einstiegsprodukt ist eng auf das folgende Zielwissen bezogen.",
            "Mindestens eine dokumentierte Anschlussoption reagiert auf unterschiedliche Produktlagen."
          ],
          "verificationMethods": ["expert-review", "content-walkthrough", "classroom-pilot"],
          "status": "reviewed"
        },
        {
          "id": "LXF04-PR-004",
          "title": "Vermeidbare Verarbeitung reduzieren, fachliche Anstrengung erhalten",
          "decision": "Erklärungen und Aufgaben werden nach fachlichen Einheiten segmentiert, zusammengehörige Repräsentationen verbunden und Signale nur für relevante Beziehungen eingesetzt.",
          "claimIds": [
            "CLAIM-LP-003",
            "CLAIM-V2-LXF-MAYER-001",
            "CLAIM-V2-LXF-SEGMENT-001",
            "CLAIM-V2-LXF-SIGNAL-001"
          ],
          "decisionBasis": "V2-REQ-LXF-001; LXF03-S-005; LXF03-S-006; LXF03-E-007",
          "obligation": "required",
          "appliesTo": ["learner-material", "learning-sequence", "explanation", "digital-interaction"],
          "positivePatterns": [
            "Text, Bild, Code, Zustand und Handlung verwenden konsistente Bezeichner und sichtbare Zuordnungen.",
            "Ein Segment endet an einer fachlichen Einheit und ermöglicht aktive Verarbeitung oder Wiederaufnahme."
          ],
          "antiPatterns": [
            "Pauschale Kürze, zusätzliche Klickschritte oder dekorative Hervorhebung gelten als Belastungsreduktion.",
            "Zusammengehörige Informationen müssen über mehrere Ansichten gesucht und mental rekonstruiert werden."
          ],
          "observableCriteria": [
            "Jedes Signal markiert eine fachlich benennbare Beziehung.",
            "Nach einem Segment ist eine zentrale Beziehung erklärbar oder anwendbar."
          ],
          "verificationMethods": ["expert-review", "content-walkthrough", "usability-test"],
          "status": "reviewed"
        }
      ]
    },
    {
      "id": "disciplinary-learning-action",
      "label": "Fachliche Lernhandlung",
      "principles": [
        {
          "id": "LXF04-PR-005",
          "title": "Digitale Aktivität an eine fachliche Handlung binden",
          "decision": "Jede sichtbare Aktivität und jede digitale Interaktion benennt die fachliche Beziehung, die Lernende erklären, konstruieren, prüfen, vergleichen oder revidieren sollen.",
          "claimIds": ["CLAIM-LP-001", "CLAIM-V2-LXF-ICAP-001"],
          "decisionBasis": "V2-REQ-LXF-001; LXF03-S-007; LXF03-E-006",
          "obligation": "required",
          "appliesTo": ["learner-material", "task", "digital-interaction", "assessment"],
          "positivePatterns": [
            "Eine Eingabe verändert ein fachlich interpretierbares Modell, Verfahren, Urteil oder Belegprodukt.",
            "Vergleich und Revision beziehen sich auf sichtbare Zustände oder begründete Kriterien."
          ],
          "antiPatterns": [
            "Drag-and-drop, Anklicken oder Animation werden unabhängig vom Inhalt als aktive Lernform gewertet.",
            "Das System bestätigt nur Erledigung, ohne die fachliche Beziehung sichtbar zu machen."
          ],
          "observableCriteria": [
            "Für jede Interaktion ist eine der acht Lernfunktionen angegeben.",
            "Das resultierende Produkt kann fachlich interpretiert und besprochen werden."
          ],
          "verificationMethods": ["expert-review", "content-walkthrough", "usability-test"],
          "status": "reviewed"
        },
        {
          "id": "LXF04-PR-006",
          "title": "IuM-Handlungen über Repräsentationen hinweg sichern",
          "decision": "Fachliche Progression wird an zunehmend selbstständigem Beschreiben, Strukturieren, Modellieren, Ausführen, Prüfen und Begründen sichtbar, nicht an Werkzeugwechsel oder Oberflächenkomplexität.",
          "claimIds": ["CLAIM-LP-002", "CLAIM-V2-LXF-ICAP-001"],
          "decisionBasis": "V2-REQ-CUR-001; LXF03-S-001; LXF03-E-003",
          "obligation": "required",
          "appliesTo": ["learning-sequence", "task", "assessment"],
          "positivePatterns": [
            "Lernende übersetzen zwischen Alltagssprache, Ablauf, Modell, Code, Daten oder begründetem Urteil.",
            "Wachsende Selbstständigkeit zeigt sich an einem fachlichen Produkt und transparenten Kriterien."
          ],
          "antiPatterns": [
            "Ein neues Tool oder mehr Interfaceelemente gelten automatisch als fachliche Progression.",
            "Eine Repräsentation wird bedient, aber weder erklärt noch mit anderen Darstellungen verbunden."
          ],
          "observableCriteria": [
            "Der erwartete Darstellungswechsel und seine fachliche Funktion sind benannt.",
            "Der Qualitätsmaßstab unterscheidet fachliche Genauigkeit von Bediengeschick."
          ],
          "verificationMethods": ["expert-review", "content-walkthrough", "classroom-pilot"],
          "status": "reviewed"
        }
      ]
    },
    {
      "id": "explanation-and-representation",
      "label": "Erklärung und Repräsentation",
      "principles": [
        {
          "id": "LXF04-PR-007",
          "title": "Beispiele aktiv verarbeiten",
          "decision": "Worked Examples werden mit fachlich relevanter Vorhersage, Selbsterklärung, Vergleich oder Ergänzung verbunden und anschließend in eine eigene Anwendung überführt.",